Date,Event Name,Location,Time,Link,Notes,Category,Kid Friendly,Physical Activity,Alcohol Served/Likely,Cost / Ticketing,Planning Context
"Wednesday, July 1, 2026",Movies on the Beach Tahoe City,"Commons Beach, Tahoe City",8:00 PM / dusk,https://laketahoetravel.com/events/,Added missing July 1 event.,Outdoor movie / Family entertainment,Yes,No - mostly seated,No / not central to event,Likely free,Bring blankets or low chairs; outdoor movie timing depends on dusk and weather.
"Wednesday, July 1, 2026",Music in the Park: Sonido Sueno,Truckee Regional Park,6:30 PM - 8:30 PM,https://www.visittruckeetahoe.com/things-to-do/events/music-in-the-park,Added missing July 1 event.,Live music / Concert,Yes,No - mostly seated/standing,Possible nearby; not central to event,Free,Outdoor or venue-based live music; bring layers for cool evenings and verify seating rules.
"Thursday, July 2, 2026",Tahoe City Farmers Market,"Commons Beach, Tahoe City",8:00 AM - 1:00 PM,https://www.tahoecityfarmersmarket.com/,Added missing July 2 market.,Market / Food / Shopping,Yes,Light - walking/standing,No / not central to event,Free to attend; purchases extra,"Casual outdoor market with produce, prepared foods, vendors, and a community feel."
"Thursday, July 2, 2026",Open Mic Poetry Night,"Tahoe Wine Collective, Boatworks Mall",5:30 PM - 7:30 PM,https://laketahoetravel.com/events/,Added missing July 2 recurring event.,Arts / Spoken word,Mixed / adult-leaning,No - seated/standing,Yes - wine venue,Unknown / check source,Small-format open mic at a wine venue; better for adults or older teens.
"Thursday, July 2, 2026",Tahoe Music Alive presents The Dolphins Quartet,North Tahoe Hebrew Congregation,4:00 PM - 6:00 PM,https://laketahoetravel.com/events/,Added missing July 2 event.,Live music / Concert,Yes,No - mostly seated/standing,No / not central to event,Unknown / check source,"Classical/chamber-style music event; check the presenter for tickets, seating, and program details."
"Thursday, July 2, 2026",Summerfest,University of Nevada Reno at Lake Tahoe Campus,4:00 PM - 7:00 PM,https://laketahoetravel.com/events/,Added missing July 2 nearby event.,Community / Fundraiser / Festival,Likely,Light - walking/standing,Possible / check source,Unknown / check source,Community gathering; verify ticketing and programming with the event source.
"Thursday, July 2, 2026",Local Heroes 4th of July Celebration,"Various venues, Incline Village",See source schedule,https://laketahoetravel.com/events/,Added missing holiday-week event.,Holiday / Community festival,Yes,Light - walking/crowds,Varies by venue,Free or mixed; check source schedule,"Holiday programming may include multiple venues, crowds, closures, and changing schedules."
"Friday, July 3, 2026",Tahoe City 4th of July Celebrations,"Various venues, Tahoe City",See source schedule,https://laketahoetravel.com/events/,Added missing holiday-week event.,Holiday / Community festival,Yes,Light - walking/crowds,Varies by venue,Free or mixed; check source schedule,"Holiday programming may include multiple venues, crowds, closures, and changing schedules."
"Friday, July 3, 2026",Local Heroes 4th of July Celebration,"Various venues, Incline Village",8:00 AM - 6:00 PM,https://laketahoetravel.com/events/,Added missing holiday-week event.,Holiday / Community festival,Yes,Light - walking/crowds,Varies by venue,Free or mixed; check source schedule,"Holiday programming may include multiple venues, crowds, closures, and changing schedules."
"Friday, July 3, 2026",Music on the Beach,Kings Beach State Recreation Area,6:00 PM - 8:30 PM,https://laketahoetravel.com/events/,Added missing July 3 concert.,Live music / Concert,Yes,No - mostly seated/standing,Possible nearby; not central to event,Free,Outdoor or venue-based live music; bring layers for cool evenings and verify seating rules.
"Friday, July 3, 2026",SunSets Live Music Series,Palisades Tahoe Events Plaza Stage or Mid Village,5:30 PM - 7:30 PM,https://laketahoetravel.com/events/,Added missing July 3 concert.,Live music / Concert,Yes,No - mostly seated/standing,Available nearby at Palisades venues,Likely free,Outdoor Palisades live music series; casual evening option with food and drinks nearby.
"Friday, July 3, 2026",Northstar Summer Stage Music,Northstar California,5:00 PM - 8:00 PM,https://laketahoetravel.com/events/,Corrected Northstar series to Fridays.,Live music / Concert,Yes,No - mostly seated/standing,Available nearby at village venues,Likely free,Village-based outdoor live music; easygoing spectator event with dining nearby.
"Friday, July 3, 2026",Blind Flight Fridays,Boatworks Mall,5:00 PM,https://laketahoetravel.com/events/,Added recurring Boatworks Mall activity.,Food & drink / Wine tasting,No - 21+,No - seated/standing,Yes - 21+ wine tasting,Paid / purchases likely,Wine-focused tasting activity at Boatworks Mall.
"Saturday, July 4, 2026",Tahoe City 4th of July Celebrations,"Various venues, Tahoe City",9:00 PM - 11:00 PM,https://laketahoetravel.com/events/,Added missing July 4 event.,Holiday / Community festival,Yes,Light - walking/crowds,Varies by venue,Free or mixed; check source schedule,"Holiday programming may include multiple venues, crowds, closures, and changing schedules."
"Saturday, July 4, 2026",Local Heroes 4th of July Celebration,"Various venues, Incline Village",8:00 AM - 9:30 PM,https://laketahoetravel.com/events/,Added missing holiday-week event.,Holiday / Community festival,Yes,Light - walking/crowds,Varies by venue,Free or mixed; check source schedule,"Holiday programming may include multiple venues, crowds, closures, and changing schedules."
"Saturday, July 4, 2026",Big Blue Adventure Run To The Beach,North Tahoe Regional Park,7:00 AM - 12:30 PM,https://laketahoetravel.com/events/,Added missing July 4 race.,Sports / Race / Endurance,Spectator-friendly; participant ages vary,Yes - strenuous for participants,No / not central to event,Registration required for participants; spectators usually free,"Athletic event with possible road, parking, or beach impacts; check race-day logistics."
"Saturday, July 4, 2026",Live Music with Local Artists,Tahoe National Brewing Co.,7:00 PM - 9:00 PM,https://laketahoetravel.com/events/,Replaces unverified Thursday trivia entries.,Live music / Concert,Mixed / check brewery policy,No - mostly seated/standing,Yes - brewery venue,Likely free; food/drink extra,Local musician performance at a brewery; best for adults or families comfortable in a brewery setting.
"Sunday, July 5, 2026",Tahoe City 4th of July Celebrations,"Various venues, Tahoe City",10:00 AM - 5:00 PM,https://laketahoetravel.com/events/,Added missing holiday-week event.,Holiday / Community festival,Yes,Light - walking/crowds,Varies by venue,Free or mixed; check source schedule,"Holiday programming may include multiple venues, crowds, closures, and changing schedules."
"Sunday, July 5, 2026",Local Heroes 4th of July Celebration,"Various venues, Incline Village",6:00 AM - 10:00 AM,https://laketahoetravel.com/events/,Added missing holiday-week event.,Holiday / Community festival,Yes,Light - walking/crowds,Varies by venue,Free or mixed; check source schedule,"Holiday programming may include multiple venues, crowds, closures, and changing schedules."
"Tuesday, July 7, 2026",Truckee Farmers Market,Truckee Regional Park,8:00 AM - 1:00 PM,https://www.visittruckeetahoe.com/things-to-do/events/truckee-farmers-market,Added recurring Truckee market.,Market / Food / Shopping,Yes,Light - walking/standing,No / not central to event,Free to attend; purchases extra,"Casual outdoor market with produce, prepared foods, vendors, and a community feel."
"Tuesday, July 7, 2026",Bluesdays,Village at Palisades Tahoe,6:00 PM - 8:30 PM,https://laketahoetravel.com/events/,Cleaned event name.,Live music / Concert,Yes,No - mostly seated/standing,Available nearby at Palisades venues,Likely free,Outdoor Tuesday blues concert in the Palisades village; popular casual evening event.
"Tuesday, July 7, 2026",Grooves by the Greens: Mike Sinclair,The Lodge Pavilion at Tahoe Donner,6:00 PM - 8:00 PM,https://www.visittruckeetahoe.com/things-to-do/events/grooves-by-the-greens,Added artist from source.,Live music / Concert,Yes,No - mostly seated/standing,Possible nearby; not central to event,Free,Outdoor or venue-based live music; bring layers for cool evenings and verify seating rules.
"Wednesday, July 8, 2026",Lake Tahoe Destination Stewardship Council Talk,"Tahoe Gal, Tahoe City",5:30 PM - 8:30 PM,https://laketahoetravel.com/events/,Corrected event name from Tahoe Talks on the Water.,Educational / Cultural talk,Likely,No - mostly seated/standing,No / not central to event,Unknown / check source,"Learning-focused program; good for visitors interested in local history, stewardship, or culture."
"Wednesday, July 8, 2026",Music in the Park: Blues Monsters,Truckee Regional Park,6:30 PM - 8:30 PM,https://www.visittruckeetahoe.com/things-to-do/events/music-in-the-park,Added artist from source.,Live music / Concert,Yes,No - mostly seated/standing,Possible nearby; not central to event,Free,Outdoor or venue-based live music; bring layers for cool evenings and verify seating rules.
"Wednesday, July 8, 2026",Movies on the Beach Tahoe City,"Commons Beach, Tahoe City",8:00 PM / dusk,https://laketahoetravel.com/events/,Cleaned time.,Outdoor movie / Family entertainment,Yes,No - mostly seated,No / not central to event,Likely free,Bring blankets or low chairs; outdoor movie timing depends on dusk and weather.
"Thursday, July 9, 2026",Tahoe City Farmers Market,"Commons Beach, Tahoe City",8:00 AM - 1:00 PM,https://www.tahoecityfarmersmarket.com/,Verified recurring market.,Market / Food / Shopping,Yes,Light - walking/standing,No / not central to event,Free to attend; purchases extra,"Casual outdoor market with produce, prepared foods, vendors, and a community feel."
"Thursday, July 9, 2026",Truckee Thursdays,Historic Downtown Truckee,5:00 PM - 8:30 PM,https://www.visittruckeetahoe.com/things-to-do/events/truckee-thursdays,Verified recurring event.,Street festival / Food / Shopping / Music,Yes,Light - walking/standing,Yes / beer garden likely,Free to attend; purchases extra,"Downtown street festival with vendors, food, music, kids activities, and crowds."
"Thursday, July 9, 2026",Open Mic Poetry Night,"Tahoe Wine Collective, Boatworks Mall",5:30 PM - 7:30 PM,https://laketahoetravel.com/events/,Verified recurring event.,Arts / Spoken word,Mixed / adult-leaning,No - seated/standing,Yes - wine venue,Unknown / check source,Small-format open mic at a wine venue; better for adults or older teens.
"Thursday, July 9, 2026",Dinner Reservation at Savoie,"Savoie, Tahoe City",6:00 PM,https://www.google.com/maps/search/?api=1&query=Savoie%20Tahoe%20City%20CA,Added from reservation screenshot.,Food & drink / Dinner reservation,Mixed / restaurant setting,No - seated,Yes - restaurant/bar likely,Paid / reservation,"Dinner reservation at Savoie in Tahoe City; plan for restaurant parking, arrival time, and confirmation details."
"Thursday, July 9, 2026",Tunes on Tap Sunset Concert Series,"Alibi Amphitheater, Incline Village",7:00 PM - 10:00 PM,https://laketahoetravel.com/events/,Added nearby Thursday concert.,Live music / Concert,Mixed / check venue policy,No - mostly seated/standing,Yes - brewery venue,Free,Free concert series at Alibi Amphitheater/beer garden setting; adult beverages likely central.
"Friday, July 10, 2026",Wild Soul Festival,Palisades Tahoe,9:00 AM,https://laketahoetravel.com/events/,Corrected from all-day to listed start time.,Wellness festival / Music,Mixed / check festival rules,Yes - yoga/wellness activities optional,Possible at Palisades venues,Ticketed / paid likely,"Wellness-focused festival with yoga, meditation, music, workshops, and mountain activities."
"Friday, July 10, 2026",Washoe Cultural Talk,"The Aerial Tram and High Camp, Palisades Tahoe",10:00 AM - 11:00 AM,https://laketahoetravel.com/events/,Added Palisades activity.,Educational / Cultural talk,Likely,No - mostly seated/standing,No / not central to event,Unknown / check source,"Learning-focused program; good for visitors interested in local history, stewardship, or culture."
"Friday, July 10, 2026",SunSets Live Music Series,Palisades Tahoe Events Plaza Stage or Mid Village,5:30 PM - 7:30 PM,https://laketahoetravel.com/events/,Verified recurring Friday series.,Live music / Concert,Yes,No - mostly seated/standing,Available nearby at Palisades venues,Likely free,Outdoor Palisades live music series; casual evening option with food and drinks nearby.
"Friday, July 10, 2026",Music on the Beach,Kings Beach State Recreation Area,6:00 PM - 8:30 PM,https://laketahoetravel.com/events/,Verified recurring Friday series.,Live music / Concert,Yes,No - mostly seated/standing,Possible nearby; not central to event,Free,Outdoor or venue-based live music; bring layers for cool evenings and verify seating rules.
"Friday, July 10, 2026",Northstar Summer Stage Music,Northstar California,5:00 PM - 8:00 PM,https://laketahoetravel.com/events/,Moved from Saturday to Friday.,Live music / Concert,Yes,No - mostly seated/standing,Available nearby at village venues,Likely free,Village-based outdoor live music; easygoing spectator event with dining nearby.
"Friday, July 10, 2026",Blind Flight Fridays,Boatworks Mall,5:00 PM,https://laketahoetravel.com/events/,Added recurring Boatworks Mall activity.,Food & drink / Wine tasting,No - 21+,No - seated/standing,Yes - 21+ wine tasting,Paid / purchases likely,Wine-focused tasting activity at Boatworks Mall.
"Saturday, July 11, 2026",Wild Soul Festival,Palisades Tahoe,9:00 AM,https://laketahoetravel.com/events/,Corrected from all-day to listed start time.,Wellness festival / Music,Mixed / check festival rules,Yes - yoga/wellness activities optional,Possible at Palisades venues,Ticketed / paid likely,"Wellness-focused festival with yoga, meditation, music, workshops, and mountain activities."
"Saturday, July 11, 2026",Tahoe Off-Road Triathlon,"Commons Beach, Tahoe City",6:00 AM - 12:30 PM,https://laketahoetravel.com/events/,Added Tahoe City race.,Sports / Race / Endurance,Spectator-friendly; participant ages vary,Yes - strenuous for participants,No / not central to event,Registration required for participants; spectators usually free,"Athletic event with possible road, parking, or beach impacts; check race-day logistics."
"Saturday, July 11, 2026",Tahoe City Swim,"Commons Beach, Tahoe City",8:30 AM - 12:00 PM,https://laketahoetravel.com/events/,Added Tahoe City swim.,Sports / Race / Endurance,Spectator-friendly; participant ages vary,Yes - strenuous for participants,No / not central to event,Registration required for participants; spectators usually free,"Athletic event with possible road, parking, or beach impacts; check race-day logistics."
"Saturday, July 11, 2026",Truckee Brewfest,Truckee Regional Park,1:00 PM - 5:00 PM,https://www.visittruckeetahoe.com/things-to-do/events-calendar,Verified.,Food & drink / Beer festival,Adult-leaning; check age rules,Light - walking/standing,Yes - beer tasting event,Ticketed / paid likely,Craft beverage festival with tastings and live music; best treated as an adult-oriented event.
"Saturday, July 11, 2026",Music by the Meadow: Dad's Lame Playlist,"Pizza on the Hill, Tahoe Donner",5:00 PM - 7:00 PM,https://www.visittruckeetahoe.com/things-to-do/events/music-by-the-meadow,Added recurring Saturday concert.,Live music / Concert,Yes,No - mostly seated/standing,Possible nearby; not central to event,Free,Outdoor or venue-based live music; bring layers for cool evenings and verify seating rules.
"Saturday, July 11, 2026",Live Music with Local Artists,Tahoe National Brewing Co.,7:00 PM - 9:00 PM,https://laketahoetravel.com/events/,Replaces unverified Thursday trivia.,Live music / Concert,Mixed / check brewery policy,No - mostly seated/standing,Yes - brewery venue,Likely free; food/drink extra,Local musician performance at a brewery; best for adults or families comfortable in a brewery setting.
"Saturday, July 11, 2026",Donner Memorial State Park Campfire Program,Donner Memorial State Park,8:00 PM - 9:00 PM,https://www.visittruckeetahoe.com/things-to-do/events/donner-memorial-state-park-campfire-programs,Added family activity.,Family / Educational / Park program,Yes,Light - walking to amphitheater,No / not central to event,Free or park entry fee may apply,Ranger-style evening program; bring warm layers and seating if recommended.
"Sunday, July 12, 2026",Wild Soul Festival,Palisades Tahoe,9:00 AM,https://laketahoetravel.com/events/,Corrected from all-day to listed start time.,Wellness festival / Music,Mixed / check festival rules,Yes - yoga/wellness activities optional,Possible at Palisades venues,Ticketed / paid likely,"Wellness-focused festival with yoga, meditation, music, workshops, and mountain activities."
"Sunday, July 12, 2026",Concerts at Commons Beach: Moga Family Band,"Commons Beach, Tahoe City",4:00 PM - 7:00 PM,https://laketahoetravel.com/event/concerts-at-commons-beach/,Added artist from source.,Live music / Concert,Yes,No - mostly seated/standing,Possible nearby; not central to event,Free,Outdoor or venue-based live music; bring layers for cool evenings and verify seating rules.
"Sunday, July 12, 2026",Summer Sunday Funday,Alibi Ale Works Incline Public House,12:00 PM - 4:00 PM,https://laketahoetravel.com/events/,Added nearby Sunday event.,Food & drink / Social event,Mixed / check venue policy,No - mostly seated/standing,Yes - brewery/pub venue,Free to attend unless noted; food/drink extra,Casual Sunday social at Alibi; likely best for adults or families comfortable at a pub.
"Tuesday, July 14, 2026",Truckee Farmers Market,Truckee Regional Park,8:00 AM - 1:00 PM,https://www.visittruckeetahoe.com/things-to-do/events/truckee-farmers-market,Added recurring Truckee market.,Market / Food / Shopping,Yes,Light - walking/standing,No / not central to event,Free to attend; purchases extra,"Casual outdoor market with produce, prepared foods, vendors, and a community feel."
"Tuesday, July 14, 2026",Bluesdays,Village at Palisades Tahoe,6:00 PM - 8:30 PM,https://laketahoetravel.com/events/,Verified recurring Tuesday series.,Live music / Concert,Yes,No - mostly seated/standing,Available nearby at Palisades venues,Likely free,Outdoor Tuesday blues concert in the Palisades village; popular casual evening event.
"Tuesday, July 14, 2026",Grooves by the Greens: Michael Burster,The Lodge Pavilion at Tahoe Donner,6:00 PM - 8:00 PM,https://www.visittruckeetahoe.com/things-to-do/events/grooves-by-the-greens,Added artist from source.,Live music / Concert,Yes,No - mostly seated/standing,Possible nearby; not central to event,Free,Outdoor or venue-based live music; bring layers for cool evenings and verify seating rules.
"Wednesday, July 15, 2026",Music in the Park: Broken Compass Bluegrass,Truckee Regional Park,6:30 PM - 8:30 PM,https://www.visittruckeetahoe.com/things-to-do/events/music-in-the-park,Added artist from source.,Live music / Concert,Yes,No - mostly seated/standing,Possible nearby; not central to event,Free,Outdoor or venue-based live music; bring layers for cool evenings and verify seating rules.
"Wednesday, July 15, 2026",Movies on the Beach Tahoe City,"Commons Beach, Tahoe City",8:00 PM / dusk,https://laketahoetravel.com/events/,Cleaned time.,Outdoor movie / Family entertainment,Yes,No - mostly seated,No / not central to event,Likely free,Bring blankets or low chairs; outdoor movie timing depends on dusk and weather.
"Wednesday, July 15, 2026",Alpine Glow Kayak Tour,Sugar Pine Point State Park Day Use Area,6:30 PM - 8:30 PM,https://laketahoetravel.com/events/,Added nearby activity.,Outdoor recreation / Water activity,Likely with age/ability limits,Yes - paddling,No / not central to event,Paid / reservation likely,"Guided paddling activity; weather, water conditions, and reservations matter."
"Thursday, July 16, 2026",Tahoe City Farmers Market,"Commons Beach, Tahoe City",8:00 AM - 1:00 PM,https://www.tahoecityfarmersmarket.com/,Verified recurring market.,Market / Food / Shopping,Yes,Light - walking/standing,No / not central to event,Free to attend; purchases extra,"Casual outdoor market with produce, prepared foods, vendors, and a community feel."
"Thursday, July 16, 2026",Truckee Thursdays,Historic Downtown Truckee,5:00 PM - 8:30 PM,https://www.visittruckeetahoe.com/things-to-do/events/truckee-thursdays,Verified recurring event.,Street festival / Food / Shopping / Music,Yes,Light - walking/standing,Yes / beer garden likely,Free to attend; purchases extra,"Downtown street festival with vendors, food, music, kids activities, and crowds."
"Thursday, July 16, 2026",Open Mic Poetry Night,"Tahoe Wine Collective, Boatworks Mall",5:30 PM - 7:30 PM,https://laketahoetravel.com/events/,Verified recurring event.,Arts / Spoken word,Mixed / adult-leaning,No - seated/standing,Yes - wine venue,Unknown / check source,Small-format open mic at a wine venue; better for adults or older teens.
"Thursday, July 16, 2026",Tunes on Tap Sunset Concert Series,"Alibi Amphitheater, Incline Village",7:00 PM - 10:00 PM,https://laketahoetravel.com/events/,Added nearby Thursday concert.,Live music / Concert,Mixed / check venue policy,No - mostly seated/standing,Yes - brewery venue,Free,Free concert series at Alibi Amphitheater/beer garden setting; adult beverages likely central.
"Friday, July 17, 2026",Washoe Cultural Talk,"The Aerial Tram and High Camp, Palisades Tahoe",10:00 AM - 11:00 AM,https://laketahoetravel.com/events/,Added Palisades activity.,Educational / Cultural talk,Likely,No - mostly seated/standing,No / not central to event,Unknown / check source,"Learning-focused program; good for visitors interested in local history, stewardship, or culture."
"Friday, July 17, 2026",SunSets Live Music Series,Palisades Tahoe Events Plaza Stage or Mid Village,5:30 PM - 7:30 PM,https://laketahoetravel.com/events/,Verified recurring Friday series.,Live music / Concert,Yes,No - mostly seated/standing,Available nearby at Palisades venues,Likely free,Outdoor Palisades live music series; casual evening option with food and drinks nearby.
"Friday, July 17, 2026",Music on the Beach,Kings Beach State Recreation Area,6:00 PM - 8:30 PM,https://laketahoetravel.com/events/,Verified recurring Friday series.,Live music / Concert,Yes,No - mostly seated/standing,Possible nearby; not central to event,Free,Outdoor or venue-based live music; bring layers for cool evenings and verify seating rules.
"Friday, July 17, 2026",Northstar Summer Stage Music,Northstar California,5:00 PM - 8:00 PM,https://laketahoetravel.com/events/,Moved from Saturday to Friday.,Live music / Concert,Yes,No - mostly seated/standing,Available nearby at village venues,Likely free,Village-based outdoor live music; easygoing spectator event with dining nearby.
"Friday, July 17, 2026",Blind Flight Fridays,Boatworks Mall,5:00 PM,https://laketahoetravel.com/events/,Added recurring Boatworks Mall activity.,Food & drink / Wine tasting,No - 21+,No - seated/standing,Yes - 21+ wine tasting,Paid / purchases likely,Wine-focused tasting activity at Boatworks Mall.
"Saturday, July 18, 2026",Big Blue Adventure Tahoe 100,Highlands Community Center,8:00 AM - 5:00 PM,https://laketahoetravel.com/events/,Added endurance event.,Sports / Race / Endurance,Spectator-friendly; participant ages vary,Yes - strenuous for participants,No / not central to event,Registration required for participants; spectators usually free,"Athletic event with possible road, parking, or beach impacts; check race-day logistics."
"Saturday, July 18, 2026",Music by the Meadow: Funky Frontier,"Pizza on the Hill, Tahoe Donner",5:00 PM - 7:00 PM,https://www.visittruckeetahoe.com/things-to-do/events/music-by-the-meadow,Added recurring Saturday concert.,Live music / Concert,Yes,No - mostly seated/standing,Possible nearby; not central to event,Free,Outdoor or venue-based live music; bring layers for cool evenings and verify seating rules.
"Saturday, July 18, 2026",Sierra Speaker Series: The Bidwell-Bartleson Party,Donner Memorial State Park,5:00 PM - 6:30 PM,https://laketahoetravel.com/events/,Added history program.,Educational / Cultural talk,Likely,No - mostly seated/standing,No / not central to event,Unknown / check source,"Learning-focused program; good for visitors interested in local history, stewardship, or culture."
"Saturday, July 18, 2026",Live Music with Local Artists,Tahoe National Brewing Co.,7:00 PM - 9:00 PM,https://laketahoetravel.com/events/,Replaces unverified Thursday trivia.,Live music / Concert,Mixed / check brewery policy,No - mostly seated/standing,Yes - brewery venue,Likely free; food/drink extra,Local musician performance at a brewery; best for adults or families comfortable in a brewery setting.
"Sunday, July 19, 2026",Concerts at Commons Beach: Big Blue Guitarmageddon,"Commons Beach, Tahoe City",4:00 PM - 7:00 PM,https://laketahoetravel.com/event/concerts-at-commons-beach/,Added artist from source.,Live music / Concert,Yes,No - mostly seated/standing,Possible nearby; not central to event,Free,Outdoor or venue-based live music; bring layers for cool evenings and verify seating rules.
"Sunday, July 19, 2026",Summer Sunday Funday,Alibi Ale Works Incline Public House,12:00 PM - 4:00 PM,https://laketahoetravel.com/events/,Added nearby Sunday event.,Food & drink / Social event,Mixed / check venue policy,No - mostly seated/standing,Yes - brewery/pub venue,Free to attend unless noted; food/drink extra,Casual Sunday social at Alibi; likely best for adults or families comfortable at a pub.
